{"bundleSha256":"ee92347b5ebf2e8146f758580b27cf0e57fa49e0c5281017ba58f82d9df044c5","compiledWriterQualified":false,"deltaSha256":"5da9550520649333f04588dbd9587bfbb122c5c5daf050d8de2232fa3e4fd3bb","framesQualified":false,"inputHash":"aaaaaaaaaaaaaaaaaaaaaaaaaaaaaaaaaaaaaaaaaaaaaaaaaaaaaaaaaaaaaaaa","kind":"geometry_authoring_preflight","members":[{"changedRecords":0,"memberId":"lod:0/mesh:0/buffer:0","positionPreflight":"passed","triangles":3},{"changedRecords":0,"memberId":"lod:1/mesh:1/buffer:0","positionPreflight":"passed","triangles":3}],"runtimeQualified":false,"schemaVersion":1}